{
  "schema_version": "1.0",
  "scope": "team",
  "generated_for": "AE Team",
  "period": "last 3 calls",
  "stats": {
    "calls_analyzed": 3,
    "avg_overall_score": 59.7,
    "by_call_type": {
      "discovery": 1,
      "demo": 1,
      "cold-call": 1
    }
  },
  "focus_areas": [
    {
      "criterion_id": null,
      "title": "Clear Next Steps with the Right People",
      "detail": "After excellent discovery, the call ended with 'send me a summary' — an open loop with no date and no commitment. A document is not a next step; a meeting on the calendar is. This is the single biggest risk to the deal.",
      "priority": "high",
      "evidence_count": 1,
      "avg_score": 38.0,
      "trend": null,
      "example_calls": [
        "discovery_acme"
      ],
      "drill": "I'll have that summary to you Thursday. Rather than you reading it cold, can we grab 30 minutes Friday so I can walk you and ideally your VP of Finance through it and the rough ROI? I'll send an invite for 2pm — does that work, or is morning better?",
      "affected_reps": [
        "Jordan"
      ]
    },
    {
      "criterion_id": null,
      "title": "Booking the Meeting",
      "detail": "Ask for a specific time, not an email.",
      "priority": "high",
      "evidence_count": 1,
      "avg_score": 38.0,
      "trend": null,
      "example_calls": [
        "cold_call_hooli"
      ],
      "drill": "'How about we grab 15 minutes Wednesday at 10 so I can show you, rather than an email that gets buried?'",
      "affected_reps": [
        "Alex"
      ]
    },
    {
      "criterion_id": null,
      "title": "Interactivity & Comprehension Checks",
      "detail": "Check in during the demo.",
      "priority": "low",
      "evidence_count": 1,
      "avg_score": 45.0,
      "trend": null,
      "example_calls": [
        "demo_globex"
      ],
      "drill": "Pause: 'Before I go on — how does this compare to how you do it today?'",
      "affected_reps": [
        "Riley"
      ]
    },
    {
      "criterion_id": null,
      "title": "Clear Next Step into Post-Sale",
      "detail": "Lock a calendared next step.",
      "priority": "low",
      "evidence_count": 1,
      "avg_score": 48.0,
      "trend": null,
      "example_calls": [
        "demo_globex"
      ],
      "drill": "'Let's get the pilot scoping on the calendar — does Thursday 2pm work?'",
      "affected_reps": [
        "Riley"
      ]
    },
    {
      "criterion_id": null,
      "title": "Differentiation",
      "detail": null,
      "priority": "low",
      "evidence_count": 1,
      "avg_score": 52.0,
      "trend": null,
      "example_calls": [
        "demo_globex"
      ],
      "drill": null,
      "affected_reps": [
        "Riley"
      ]
    },
    {
      "criterion_id": null,
      "title": "Decision Process & Stakeholders",
      "detail": "Jordan correctly identified that Finance and Operations own sign-off, then left it to Sam to 'feel it out.' Single-threaded deals stall. Make it easy and low-risk for Sam to bring them in now, while the pain is hot.",
      "priority": "low",
      "evidence_count": 1,
      "avg_score": 55.0,
      "trend": null,
      "example_calls": [
        "discovery_acme"
      ],
      "drill": "Totally fair to socialize it first. To make that easy — want me to send a short, two-paragraph summary written for them, framed around the board-prep angle your Head of Ops has been pushing? Then if it resonates, the three of you join the Friday session. What's the best way to get on her radar?",
      "affected_reps": [
        "Jordan"
      ]
    }
  ],
  "wins": [
    {
      "title": "Current State & Why It Isn't Working",
      "detail": null,
      "evidence_count": 1
    },
    {
      "title": "Compelling Event & Timing",
      "detail": null,
      "evidence_count": 1
    },
    {
      "title": "Ideal Future State",
      "detail": null,
      "evidence_count": 1
    }
  ],
  "members": [
    {
      "name": "Alex",
      "calls_analyzed": 1,
      "avg_overall_score": 55.0,
      "top_focus": "Booking the Meeting"
    },
    {
      "name": "Jordan",
      "calls_analyzed": 1,
      "avg_overall_score": 70.0,
      "top_focus": "Decision Process & Stakeholders"
    },
    {
      "name": "Riley",
      "calls_analyzed": 1,
      "avg_overall_score": 54.0,
      "top_focus": "Interactivity & Comprehension Checks"
    }
  ]
}